{
  "v": 1,
  "type": "visemes",
  "id": "00000000-0000-4000-8000-000000000002",
  "ts": 1793180002000,
  "data": {
    "utterance_id": "u-1",
    "frames": [
      {
        "t_ms": 0,
        "viseme": 0
      },
      {
        "t_ms": 120,
        "viseme": 12
      },
      {
        "t_ms": 260,
        "viseme": 4
      }
    ]
  }
}
